{
  "$schema": "../../schemas/evidence.schema.json",
  "schemaVersion": "1.0.0",
  "id": "ev-v1-06-repo-check-a9b2f8e",
  "taskId": "V1-06",
  "type": "command-run",
  "actor": "validation-gate",
  "commit": "a9b2f8e78cd4a0a43d34527af9795db0d43a175a",
  "createdAt": "2026-08-14T07:15:03Z",
  "result": {
    "status": "pass",
    "checks": [
      {
        "name": "pnpm check",
        "status": "pass",
        "summary": "The exact repaired candidate passed formatting, plan validation, lint, dead-code analysis, typechecking, all 223 tests, build, and package smoke checks."
      }
    ]
  },
  "inputs": {
    "planDigest": "sha256:1c759a5f00ef6e2afdd4214e595947231da0d6f5ce63135b162e98c48223f056",
    "lockfileDigest": "sha256:0d73c2bc837d2f12314c6fb3b2f28c4389a3887a5fdda7b6898913b2b20c91d9"
  },
  "gateBinding": { "gateId": "QG-REPO-CHECK", "kind": "command", "command": "pnpm check" },
  "review": null,
  "redaction": {
    "status": "verified",
    "containsRawModelOutput": false,
    "containsSecrets": false
  }
}
