{
  "$schema": "../../schemas/evidence.schema.json",
  "schemaVersion": "1.0.0",
  "id": "ev-v1-06-contracts-bd52e07",
  "taskId": "V1-06",
  "type": "command-run",
  "actor": "validation-gate",
  "commit": "bd52e07df008edf27d10c221ba29cf2c9dbd3eb9",
  "createdAt": "2026-08-14T07:39:45Z",
  "result": {
    "status": "pass",
    "checks": [
      {
        "name": "pnpm test:contracts",
        "status": "pass",
        "summary": "All 225 deterministic contract and adversarial tests passed, including authenticated refresh ordering, zero-effect compatibility rejection, and bounded receipt reads."
      }
    ]
  },
  "inputs": {
    "planDigest": "sha256:1c759a5f00ef6e2afdd4214e595947231da0d6f5ce63135b162e98c48223f056",
    "lockfileDigest": "sha256:0d73c2bc837d2f12314c6fb3b2f28c4389a3887a5fdda7b6898913b2b20c91d9"
  },
  "gateBinding": {
    "gateId": "QG-CONTRACTS",
    "kind": "command",
    "command": "pnpm test:contracts"
  },
  "review": null,
  "redaction": {
    "status": "verified",
    "containsRawModelOutput": false,
    "containsSecrets": false
  }
}
