{
  "$schema": "../../schemas/evidence.schema.json",
  "schemaVersion": "1.0.0",
  "id": "ev-v1-03-repo-check-fb67799",
  "taskId": "V1-03",
  "type": "command-run",
  "actor": "implementation-agent",
  "commit": "fb67799756618b5b53b1efe63a38dbfcb5e30591",
  "createdAt": "2026-08-11T13:45:00Z",
  "result": {
    "status": "pass",
    "checks": [
      {
        "name": "pnpm check",
        "status": "pass",
        "summary": "The exact post-authorization scanner candidate passed formatting, plan validation, lint, dead-code analysis, typechecking, all 136 repository tests, build, and package smoke checks."
      }
    ]
  },
  "inputs": {
    "planDigest": "sha256:7905c3b7c9091bd45557ea58808e3c8b4f6dcad423939e835ecc0dabed391397",
    "lockfileDigest": "sha256:0568848490d539fc4b1a4cd53c2ddd95108a15a0ad1ea37ff6c14f1b748db6ac"
  },
  "gateBinding": {
    "gateId": "QG-REPO-CHECK",
    "kind": "command",
    "command": "pnpm check"
  },
  "review": null,
  "redaction": {
    "status": "not_applicable",
    "containsRawModelOutput": false,
    "containsSecrets": false
  }
}
