{
  "$schema": "../../schemas/evidence.schema.json",
  "schemaVersion": "1.0.0",
  "id": "ev-m0-14-contracts-af7b691",
  "taskId": "M0-14",
  "type": "command-run",
  "actor": "validation-gate",
  "commit": "af7b691214e7baa66b40832ef189575ec051471b",
  "createdAt": "2026-08-14T16:33:46Z",
  "result": {
    "status": "pass",
    "checks": [
      {
        "name": "pnpm test:contracts",
        "status": "pass",
        "summary": "All 303 deterministic tests passed, including the terminal policy regressions."
      }
    ]
  },
  "inputs": {
    "planDigest": "sha256:b334019e8095cb79e226c82a7ccfcd4f46a2e002e27aa52766780b961f6d5e44",
    "lockfileDigest": "sha256:0d73c2bc837d2f12314c6fb3b2f28c4389a3887a5fdda7b6898913b2b20c91d9"
  },
  "gateBinding": { "gateId": "QG-CONTRACTS", "kind": "command", "command": "pnpm test:contracts" },
  "review": null,
  "redaction": {
    "status": "not_applicable",
    "containsRawModelOutput": false,
    "containsSecrets": false
  }
}
