{
  "$schema": "../../schemas/evidence.schema.json",
  "schemaVersion": "1.0.0",
  "id": "ev-v1-03-repo-check-c4a9886",
  "taskId": "V1-03",
  "type": "command-run",
  "actor": "implementation-agent",
  "commit": "c4a9886d9fff9b2ea65d97f9cccdc896813c6f99",
  "createdAt": "2026-08-11T11:23:20Z",
  "result": {
    "status": "pass",
    "checks": [
      {
        "name": "pnpm check",
        "status": "pass",
        "summary": "The exact candidate passed formatting, plan validation, lint, dead-code analysis, typechecking, all 122 tests, build, and package smoke checks."
      }
    ]
  },
  "inputs": {
    "planDigest": "sha256:d1e3f2a99410f5279739bad3170b35fc69daff60a4454b1767a568ff540c474e",
    "lockfileDigest": "sha256:0568848490d539fc4b1a4cd53c2ddd95108a15a0ad1ea37ff6c14f1b748db6ac"
  },
  "gateBinding": { "gateId": "QG-REPO-CHECK", "kind": "command", "command": "pnpm check" },
  "review": null,
  "redaction": {
    "status": "not_applicable",
    "containsRawModelOutput": false,
    "containsSecrets": false
  }
}
