{
  "$schema": "../../schemas/evidence.schema.json",
  "schemaVersion": "1.0.0",
  "id": "ev-v1-03-scanner-corpus-e1964dd",
  "taskId": "V1-03",
  "type": "command-run",
  "actor": "implementation-agent",
  "commit": "e1964dda1ff4e6db0e3e2427ea7d7e78a10067f1",
  "createdAt": "2026-08-11T11:36:58Z",
  "result": {
    "status": "pass",
    "checks": [
      {
        "name": "pnpm test:scanner-corpus",
        "status": "pass",
        "summary": "The reviewed offline corpus passed with 100% high-confidence precision and 100% supported-pattern recall; unknown and model-overriding computed keys plus reachable unshadowed direct eval remain non-patchable."
      }
    ]
  },
  "inputs": {
    "planDigest": "sha256:75a40d2659d4621f22bf563b797ba23694cce88df42a9a15764e68a5d8794a22",
    "lockfileDigest": "sha256:0568848490d539fc4b1a4cd53c2ddd95108a15a0ad1ea37ff6c14f1b748db6ac"
  },
  "gateBinding": {
    "gateId": "QG-SCANNER-CORPUS",
    "kind": "command",
    "command": "pnpm test:scanner-corpus"
  },
  "review": null,
  "redaction": { "status": "verified", "containsRawModelOutput": false, "containsSecrets": false }
}
