{
  "$schema": "../../schemas/evidence.schema.json",
  "schemaVersion": "1.0.0",
  "id": "ev-m0-11-repo-check-161971b",
  "taskId": "M0-11",
  "type": "command-run",
  "actor": "codex-local-validation",
  "commit": "161971b22e0270e71f26a757aed7786caa6e598f",
  "createdAt": "2026-08-14T01:05:57Z",
  "result": {
    "status": "pass",
    "checks": [
      {
        "name": "pnpm check",
        "status": "pass",
        "summary": "All 194 tests plus formatting, lint, types, builds, and package checks passed."
      }
    ]
  },
  "inputs": {
    "planDigest": "sha256:1c759a5f00ef6e2afdd4214e595947231da0d6f5ce63135b162e98c48223f056",
    "lockfileDigest": "sha256:0d73c2bc837d2f12314c6fb3b2f28c4389a3887a5fdda7b6898913b2b20c91d9"
  },
  "gateBinding": {
    "gateId": "QG-REPO-CHECK",
    "kind": "command",
    "command": "pnpm check"
  },
  "review": null,
  "redaction": {
    "status": "not_applicable",
    "containsRawModelOutput": false,
    "containsSecrets": false
  }
}
