{
  "$schema": "../../schemas/evidence.schema.json",
  "schemaVersion": "1.0.0",
  "id": "ev-v1-01-repo-check-ecde77d",
  "taskId": "V1-01",
  "type": "command-run",
  "actor": "davidahmann",
  "commit": "ecde77da2c703a93d0d56cb232ec46c21080f846",
  "createdAt": "2026-08-10T16:32:59Z",
  "result": {
    "status": "pass",
    "checks": [
      {
        "name": "pnpm check",
        "status": "pass",
        "summary": "The exact candidate passed formatting, plan validation, lint, dead-code analysis, typechecking, all 92 tests, build, and package smoke checks."
      }
    ]
  },
  "inputs": {
    "planDigest": "sha256:2904534ffb5f79aa7663ad702391ba04d09c5e63ba22d6789f4378f72ca1d652",
    "lockfileDigest": "sha256:4a89ac1f2863dc3591fae73e1ee0474cbab8cb0725ff80dfc57b1590f42d1a88"
  },
  "gateBinding": { "gateId": "QG-REPO-CHECK", "kind": "command", "command": "pnpm check" },
  "review": null,
  "redaction": { "status": "verified", "containsRawModelOutput": false, "containsSecrets": false }
}
