{
  "$schema": "../../schemas/evidence.schema.json",
  "schemaVersion": "1.0.0",
  "id": "ev-v1-00-independent-review-e188f46",
  "taskId": "V1-00",
  "type": "review",
  "actor": "davidahmann",
  "commit": "e188f4691d06a88738bd39affd0e6a296a755261",
  "createdAt": "2026-08-10T15:10:00Z",
  "result": {
    "status": "pass",
    "checks": [
      {
        "name": "independent-verifier authorization",
        "status": "pass",
        "url": "https://github.com/Clyra-AI/vetryn/pull/5#issuecomment-5242139438",
        "summary": "The current exact-format bootstrap comment authorizes the independent-verifier role for the exact candidate."
      }
    ]
  },
  "inputs": {
    "planDigest": "sha256:87aff8ebd0ca9480b099933262cec350188e73fcf8f09b9fd2ca66dd94ac37f0",
    "lockfileDigest": "sha256:4a89ac1f2863dc3591fae73e1ee0474cbab8cb0725ff80dfc57b1590f42d1a88"
  },
  "gateBinding": null,
  "review": {
    "role": "independent-verifier",
    "subjectActor": "davidahmann",
    "source": "github-bootstrap-owner-comment",
    "state": "APPROVED",
    "authorAssociation": "MEMBER",
    "commentId": 5242139438,
    "observedCommit": "e188f4691d06a88738bd39affd0e6a296a755261",
    "authorizationBody": "<!-- vetryn-bootstrap-review:v1 -->\nrepository=Clyra-AI/vetryn\npull_request=5\ntask_id=V1-00\ncandidate_sha=e188f4691d06a88738bd39affd0e6a296a755261\ndecision=APPROVED\nroles=independent-verifier,trust-reviewer,maintainer",
    "authorizationRef": "https://github.com/Clyra-AI/vetryn/pull/5#issuecomment-5242139438"
  },
  "redaction": {
    "status": "verified",
    "containsRawModelOutput": false,
    "containsSecrets": false
  }
}
