{
  "$schema": "../../schemas/evidence.schema.json",
  "schemaVersion": "1.0.0",
  "id": "ev-m0-07-repo-check-fd5da6d",
  "taskId": "M0-07",
  "type": "command-run",
  "actor": "validation-agent",
  "commit": "fd5da6d91e070255eee10048433b69f55dbc0cb6",
  "createdAt": "2026-08-11T17:34:45Z",
  "result": {
    "status": "pass",
    "checks": [
      {
        "name": "pnpm check",
        "status": "pass",
        "summary": "The exact M0-07 candidate passed formatting, plan validation, lint, dead-code analysis, typechecking, all 139 repository tests, build, and package smoke checks."
      }
    ]
  },
  "inputs": {
    "planDigest": "sha256:022399df2ebc16af56dfad44563e15aba89e72e314b9f9e4a5abdc78b9c48333",
    "lockfileDigest": "sha256:0568848490d539fc4b1a4cd53c2ddd95108a15a0ad1ea37ff6c14f1b748db6ac"
  },
  "gateBinding": {
    "gateId": "QG-REPO-CHECK",
    "kind": "command",
    "command": "pnpm check"
  },
  "review": null,
  "redaction": {
    "status": "not_applicable",
    "containsRawModelOutput": false,
    "containsSecrets": false
  }
}
