{
  "$schema": "../../schemas/evidence.schema.json",
  "schemaVersion": "1.0.0",
  "id": "ev-m0-07-repo-check-59d8ff6",
  "taskId": "M0-07",
  "type": "command-run",
  "actor": "validation-agent",
  "commit": "59d8ff60555204893c07ae17b534e14882019e13",
  "createdAt": "2026-08-11T18:20:40Z",
  "result": {
    "status": "pass",
    "checks": [
      {
        "name": "pnpm check",
        "status": "pass",
        "summary": "The exact complete-policy-authentication candidate passed formatting, plan validation, lint, dead-code analysis, typechecking, all 142 repository tests, build, and package smoke checks."
      }
    ]
  },
  "inputs": {
    "planDigest": "sha256:35679de37d8780bbc15700ab070b2156a67da4ca34d417d3d4fab14de39155f8",
    "lockfileDigest": "sha256:0568848490d539fc4b1a4cd53c2ddd95108a15a0ad1ea37ff6c14f1b748db6ac"
  },
  "gateBinding": {
    "gateId": "QG-REPO-CHECK",
    "kind": "command",
    "command": "pnpm check"
  },
  "review": null,
  "redaction": {
    "status": "not_applicable",
    "containsRawModelOutput": false,
    "containsSecrets": false
  }
}
