{
  "$schema": "../../schemas/evidence.schema.json",
  "schemaVersion": "1.0.0",
  "id": "ev-m0-10-repo-check-fc214df",
  "taskId": "M0-10",
  "type": "command-run",
  "actor": "codex-local-validation",
  "commit": "fc214dffb42e37c40f67024e95c865b0cfe89950",
  "createdAt": "2026-08-12T11:15:19Z",
  "result": {
    "status": "pass",
    "checks": [
      {
        "name": "pnpm check",
        "status": "pass",
        "summary": "Formatting, plan validation, lint, dead-code analysis, type checking, all 173 tests, build, and package checks passed on the exact documentation-aligned candidate."
      }
    ]
  },
  "inputs": {
    "planDigest": "sha256:decd90d65c1374fb35d20547a798cee7e38359085138b5482a4af1fcce0e826d",
    "lockfileDigest": "sha256:3ee6dca039a23c4a43059ce1ebb34822d4184cd53027f261dcf30de222ec80e3"
  },
  "gateBinding": { "gateId": "QG-REPO-CHECK", "kind": "command", "command": "pnpm check" },
  "review": null,
  "redaction": {
    "status": "not_applicable",
    "containsRawModelOutput": false,
    "containsSecrets": false
  }
}
