{
  "$schema": "../../schemas/evidence.schema.json",
  "schemaVersion": "1.0.0",
  "id": "ev-v1-04-contracts-f044a08",
  "taskId": "V1-04",
  "type": "command-run",
  "actor": "implementation-agent",
  "commit": "f044a087bd924cf6b0ba92b0fad21ce62b8b8d9b",
  "createdAt": "2026-08-11T04:40:28Z",
  "result": {
    "status": "pass",
    "checks": [
      {
        "name": "pnpm test:contracts",
        "status": "pass",
        "summary": "All 105 contract and integration tests passed, including explicit manifest identity, reviewed usage provenance, idempotency, collision, no-partial-write, requested-ID, and dry-run cases."
      }
    ]
  },
  "inputs": {
    "planDigest": "sha256:3906e867ba1e245654f94a761f015bf24e880393c7b99cd141314610769a61b9",
    "lockfileDigest": "sha256:b68a2a883aa93aa747fefbd98c16401d4950c585654ae83cf3ec359aa081dece"
  },
  "gateBinding": {
    "gateId": "QG-CONTRACTS",
    "kind": "command",
    "command": "pnpm test:contracts"
  },
  "review": null,
  "redaction": {
    "status": "not_applicable",
    "containsRawModelOutput": false,
    "containsSecrets": false
  }
}
